DATE,PERIOD,AUDITYPE,STORECODE,DLRCODE,ITEMCODE,NEW_CODES,CATEGORY,MANUFACTURE,BRAND,ITEMDESC,MRP,PACKSIZE,PACKTYPE,COMMENTS,IMAGE,CODE COMMENT,FLAG
2023-01-28,202301,1,132792028,31306010021,1674811690670,,106,ASIAN BISCUITS & CONFECTNRY-NP,GOODLIFE DOUBLE BREAK,GOODLIFE DOUBLE BREAK/200NOS/PCN/ASIAN BISCUITS & CONFECTNRY-NP,200.0,PCN,200NOS,,1674811690670-asian biscuits - confectnry-np-goodlife double break#3.png,PARKER FOR NEXT MONTH,999
2023-01-28,202301,1,116441817,32302010005,1674806716905,99764829.0,123,GOPAL N PRODUCT-NEPAL,ANKUR,ANKUR-EXTRA WHITENER PPH 200 GM,45.0,PPH,200 GM,,1674806716905-gopal n product-nepal-ankur#3.png,RECODING,5
2023-01-29,202301,1,212581910089,21258010005,1674815063168,99764793.0,106,SWEET MART FOOD INDUST-NEPAL,CELTERFRUIT STRAWBERRY,CELTERFRUIT STRAWBERRY\459\GM,300.0,PCN,450 GM,New SKU,1674815063168-sweet mart food indust-nepal-celterfruit strawberry#3.png,RECODING,5
2023-01-29,202301,1,212581910120,21258010007,1674812124041,99764824.0,106,PERFECT FOODS PVT LTD-NEPAL,CANDY BEE LACTO KING  RICH MILK,CANDY BEE LACTO KING RICH MILK\500\GM,200.0,PCN,500GM,New SKU,1674812124041-perfect foods pvt ltd-nepal-candy bee lacto king  rich milk#3.png,RECODING,5
2023-01-29,202301,1,122344338,12303010047,1674551466045,99763529.0,123,SWADESHI SABUN UDHYOG-NEPAL,AAHA,AAHA-LAUNDRY SOAP PPH 150GM,35.0,PPH,150GM,,1674551466045-swadeshi sabun udhyog-nepal-aaha#3.png,CROSS CODING,2
2023-01-29,202301,1,122547898,12303010049,1674548045228,99764822.0,106,CANDY LAKE NUTRITIONS PVT LTD-IN,CANDY LLAKE COCONUT,CANDY LAKE-COCONUT CANY PCN 600GM,200.0,PCN,600GM,,1674548045228-candy lake nutritions pvt ltd-in-candy llake coconut#3.png,RECODING,5
2023-01-30,202301,1,116619688,11301010020,1674028956558,99764793.0,106,SWEET MART FOOD INDUST-NEPAL,CELTERFRUIT,CELTERFRUIT-STRAWBERRY PCN 450G,290.0,PCN,450G,,1674028956558-sweet mart food indust-nepal-celterfruit#3.png,RECODING,5
2023-01-30,202301,1,116651245,11301010010,1674028956558,99764793.0,106,SWEET MART FOOD INDUST-NEPAL,CELTERFRUIT,CELTERFRUIT-STRAWBERRY PCN 450G,290.0,PCN,450G,,1674028956558-sweet mart food indust-nepal-celterfruit#3.png,RECODING,5
2023-01-30,202301,1,131605426,22201010054,1674804777045,99764828.0,120,WIPRO LTD.- INDIA,SANTOOR ALMOND SOFT,SANTOOR/44/GM/EWP/ALMOND SOFT/WIPRO ENTERPRISES P.LTD/INDIA,20.0,EWP,44,,1674804777045-wipro ltd-- india-santoor almond soft#3.png,RECODING,5
2023-01-30,202301,1,131605426,22201010054,1674802427451,99764827.0,116,RIJAL SANITARY PAD UDHYOG-NP,MY CHOICE,MY CHOICE\6\PADS\RIJAL SANITARY PAD UDHYOG\NEPAL,70.0,PPH,6 PADS,,1674802427451-rijal sanitary pad udhyog-np-my choice#3.png,RECODING,5
2023-01-30,202301,1,131605426,22201010054,1674798133259,99764826.0,106,SUJAL FOODS PVT LTD-NEPAL,SUJAL ECLAIRS,SUJAL ECLAIRS/1650/GMS/JAR/SUJAL FOODS PVT.LTD/NEPAL,600.0,JAR,1650GMS,,1674798133259-sujal foods pvt ltd-nepal-sujal eclairs#3.png,RECODING,5
2023-01-30,202301,2,128624554,21401020018,1674971602666,99764833.0,134,HYGEN PACKS NEPAL PVT LTD-NEPAL,HYGEN MANIA,HYGEN MANIA-MANGO /PET/ 500ML/HYGEN PACKS NEPAL PVT.LTD,80.0,PBT,500ML,,1674971602666-hygen packs nepal pvt ltd-nepal-hygen mania#3.png,RECODING,5
2023-01-30,202301,1,116492009,11301010011,1674811398854,99764830.0,123,HIMGIRI SOAP & CHEMICALS-NEPAL,SHAKTI,SHAKTI SCOURING BAR PPH 75 G,10.0,PPH,75G,,1674811398854-himgiri soap - chemicals-nepal-shakti#3.png,RECODING,5
2023-01-30,202301,1,116492009,11301010011,1674810830227,99764831.0,123,PUJA SOAP & HOUSEHOLD PROD-NPL,TRISHUL,TRISHUL LAUNDRY SOAP PPH 200G,35.0,PPH,200G,,1674810830227-puja soap - household prod-npl-trishul#3.png,RECODING,5
2023-01-31,202301,1,117996041,31308010008,1674978034348,99764834.0,122,SAPTRISHI SOAP INDUSTRIES-NP,SEVEN STAR,SEVEN STAR-LEMON & JASMINE PPH 200 GM,20.0,PPH,200 GM ,,1674978034348-saptrishi soap industries-np-seven star#3.png,RECODING,5
2023-01-31,202301,2,222331810135,22233020016,1675052397290,99764836.0,134,HIMAL AGRO & FOOD PVT LTD-NEPAL,SPRING KAVRE,SPRING KAVRE\1000\ML,20.0,PET ,1000ML,New SKU,1675052397290-himal agro - food pvt ltd-nepal-spring kavre#3.png,RECODING,5
2023-01-31,202301,1,222332210165,22233010007,1675051035877,99764555.0,106,SURYA NEPAL PVT LTD - NEPAL,TOFFICHOO CHATPATA FUN MASALA PUNCH,TOFFICHOO CHATPATA FUN MASALA PUNCH\720\GM,300.0,PCN,720 GM,New SKU,1675051035877-surya nepal pvt ltd - nepal-toffichoo chatpata fun masala punch#3.png,CROSS CODING,2
2023-01-31,202301,1,222332210165,22233010007,1675050528907,99764835.0,123,KWALITY CHEM PVT LTD-NEPAL,DIAL LAUNDRY SOAP,DIAL LAUNDRY SOAP\900\GM,200.0,PPH,900 GM,New SKU,1675050528907-kwality chem pvt ltd-nepal-dial laundry soap#3.png,RECODING,5
2023-01-31,202301,1,116833007,21304010007,1675062063455,,106,D-SWAG INDUSTRIES LTD-INDIA,BAKEMATE CAFE TOWN,BAKEMATE CAFE TOWN/COFFEE /HARD BOILED CANDY/D-SWG INDUSTRIES LTD INDIA/3.2GM,2.5,PPH,3.2GM,,1675062063455-d-swag industries ltd-india-bakemate cafe town#3.png,PARKER FOR NEXT MONTH,999
2023-02-01,202301,1,324251110063,32425010008,1674538082919,99764511.0,106,PERFECT FOODS PVT LTD-NEPAL,CENTER FILLZ,CENTER FILZ MIXED FRUIT\435GM\PBT\RS:300\PERFECT FOODS P. LTD NEPAL,300.0,PBT,435GM,,1674538082919-perfect foods pvt ltd-nepal-center fillz#3.png,CROSS CODING,2
2023-02-01,202301,1,516753710246,51675010007,1674904175571,99764837.0,106,SUJAL FOODS PVT LTD-NEPAL,BUBBLE FUN,BUBBLE FUN/SOFT BUBBLE GUM/625GM/PCN,200.0,PCN,625GM,,1674904175571-sujal foods pvt ltd-nepal-bubble fun#3.png,RECODING,5
2023-02-01,202301,1,516753310241,51675010002,1674897834890,99764838.0,120,MAHASHAKTI SOAP & CHEM.- NEPAL,MAYALU BEAUTY SOAP,MAYALU/ROSE/60GM/EWP,20.0,EWP,60GM ,,1674897834890-mahashakti soap - chem-- nepal-mayalu beauty soap#3.png,RECODING,5
2023-02-01,202301,1,516813610205,51681010008,1674904175571,99764837.0,106,SUJAL FOODS PVT LTD-NEPAL,BUBBLE FUN,BUBBLE FUN/SOFT BUBBLE GUM/625GM/PCN,200.0,PCN,625GM,,1674904175571-sujal foods pvt ltd-nepal-bubble fun#3.png,RECODING,5
2023-02-01,202301,1,516813610205,51681010008,1674966383140,99764825.0,132,A.G. HEALTH INDUSTRIES PVT LTD-NEPAL,SAGUN BABY DIAPERS,SAGUN BABY DIAPERS/XL ALOEVERA/4 PCS/PPH,100.0,PPH,4 PCS,,1674966383140-a-g- health industries pvt ltd-nepal-sagun baby diapers#3.png,RECODING,5
2023-02-01,202301,1,516813510153,51681010004,1674904175571,99764837.0,106,SUJAL FOODS PVT LTD-NEPAL,BUBBLE FUN,BUBBLE FUN/SOFT BUBBLE GUM/625GM/PCN,200.0,PCN,625GM,,1674904175571-sujal foods pvt ltd-nepal-bubble fun#3.png,RECODING,5
2023-02-01,202301,1,516753510207,51675010006,1674908498952,99764839.0,122,VUMI INDUSTRIES-NEPAL,VUMI ,VUMI/DETERGENT POWDER/150GM/PPH,20.0,PPH,150GM ,,1674908498952-vumi industries-nepal-vumi #3.png,RECODING,5
2023-02-01,202301,1,516865410032,51686010008,1674536662035,99764802.0,106,SUJAL FOODS PVT LTD-NEPAL,LACTO FUN,LACTO FUN/PREMIUM MALT/725GM/PCN,165.0,PCN,725GM,,1674536662035-sujal foods pvt ltd-nepal-lacto fun#3.png,RECODING,5
2023-02-01,202301,1,116904874,11301010001,1674808619964,99764840.0,123,PUJA SOAP & HOUSEHOLD PROD-NPL,TRISHUL,TRISHUL LAUNDRY SOAP PPH 300G,50.0,PPH,330G,,1674808619964-puja soap - household prod-npl-trishul#3.png,RECODING,5
2023-02-02,202302,1,129020606,22101010013,1675232316807,99764426.0,121,PATANJALI AYURVED PVT LTD-NEPAL,PATANJALI DANT KANTI,PATANJALI DANTKATI\75GM\TUBE\RED TOOTHPASTE ,55.0,TUBE,75FM,,1675232316807-patanjali ayurved pvt ltd-nepal-patanjali dant kanti#3.png,CROSS CODING,2
2023-02-02,202302,1,129020606,22101010013,1674196462690,99764783.0,106,PERFETTI VAN MELLE-INDIA,ALPENLIEBE  JUZT JELLY,ALPENLIEBE JUZT JELLY\832.5GM\PCN\STRAWBERRY FLAVOUR ,360.0,PCN,832.5GM,,1674196462690-perfetti van melle-india-alpenliebe  juzt jelly#3.png,RECODING,5
